{
  "$schema": "https://raw.githubusercontent.com/SpCoGov/shanten-lens-marketplace/main/schemas/plugin-update.schema.json",
  "schemaVersion": 1,
  "id": "com.example.packet-filter",
  "version": "1.3.0",
  "downloadUrl": "https://github.com/example/shanten-lens-packet-filter/releases/download/v1.3.0/plugin.zip",
  "sha256": "0123456789abcdef0123456789abcdef0123456789abcdef0123456789abcdef",
  "size": 1258291,
  "releaseNotes": "增加规则导入功能。",
  "releaseNotesUrl": "https://github.com/example/shanten-lens-packet-filter/releases/tag/v1.3.0",
  "publishedAt": "2026-09-10T09:00:00Z"
}
